id	replyCount	likeCount	publishedAt	authorName	text	isReply	isReplyTo	isReplyToName
ddcfb9d22c441760c4adc1bdaedf97dee100cd20	2	3	"2020-04-28 11:10:44"	70ff5acc648cd121c243004c6a1dda784a4b2c13	"Hallo, danke für das Video. Ich werde es meinen Studierenden dieses Semester empfehlen und es spart mir, für meine Lehre noch ein Video mehr drehen zu müssen. Super! :)"	0		
0e89c6b2d2d3d2e2ed6b96aa1aa2cd02031983c7		1	"2020-04-28 11:14:09"	ac101a4f0614bc247292d67592ce9a93f106db87	"Danke, eine Fortsetzung gibt es übrigens hier: https://youtu.be/HFIPQqcTEiA"	1	ddcfb9d22c441760c4adc1bdaedf97dee100cd20	70ff5acc648cd121c243004c6a1dda784a4b2c13
64e0399fc28f62afaa6b7ed62445c62a73c92126		1	"2020-04-28 11:22:08"	70ff5acc648cd121c243004c6a1dda784a4b2c13	"@@ali_tudresden Vielen lieben Dank! Perfect! :) Hab mich auch gerade schon geärgert, dass ich das Video zu loom nicht schon früher entdeckt habe! ;)"	1	ddcfb9d22c441760c4adc1bdaedf97dee100cd20	70ff5acc648cd121c243004c6a1dda784a4b2c13
0cf4067e07e3e1f8fa9c43c546337d40fae99b21	1	0	"2020-04-11 05:59:54"	962960664876cfdc03c42e1b8c4716d108b18546	"funktioniert das nur mit Chrome oder auch in Safari?"	0		
cfe0245f67033f02e3deac6d47e553cdd82492c0		0	"2020-04-11 06:28:33"	ac101a4f0614bc247292d67592ce9a93f106db87	"Safari ging zum Zeitpunkt der Videoaufzeichnung nicht, sollte jetzt aber wieder: https://www.zotero.org/download/connectors"	1	0cf4067e07e3e1f8fa9c43c546337d40fae99b21	962960664876cfdc03c42e1b8c4716d108b18546
